IA/GA/MIN/471378/2024,2024-05-02T10:29:39.867+00:00,JSW STEEL LTD,A,Mining of minerals,254.51,2900.0,KUDNE,Bicholim,Block IX Surla Sonshi Mineral Block,"Block IX Surla Sonshi Mineral Block. The auction was conducted on 27/04/2023 and JSW Steel Limited was declared as “Preferred Bidder.” The Letter of Intent was issued on 12/07/2023, The extent of the Mineral Block is 254.51 Ha and is located in Surla, Cudnem, & Sonus Vonvoliem Villages, Bicholim & Sattari Talukas, North Goa District, Goa. The proposed production capacity of 1.1 MTPA of Iron Ore   & Lessee has also proposed to install Wet Beneficiation Plant Within the  Mineral Block throughput 1.1 MTPA  . A mechanized open-cast mining method will be adopted. The Beneficiation Plant is proposed to produce Iron Ore product having average grade of +54.25% Fe from feed having low grade Iron Ore, by using Low Intensity Magnetic Separator (LIMS) , Medium Intensity Magnetic Separator (MIMS) & High Gradient Magnetic Separators (HGMS) Concentrates, Pressure Filter (for thickening of tailing in cake form)",GOA,North Goa,48250.0,113000.0,SY No 152,North Goa,GOA,626757,https://parivesh.nic.in/dms/okm/downloadDocument?docTypemappingId=40829&refId=65046836&refType=caf&uuid=3e8ea8be-95bc-4ee5-9b96-4bf4b61332ad&version=1.0,https://parivesh.nic.in/newupgrade/#/report/ec?proposalId=65053241
SIA/GA/IND1/415852/2023,2023-01-25T08:58:52.813+00:00, ORANGE FOX STEELS PRIVATE LIMITED,B1,Metallurgical Industries (ferrous and non ferrous),2.5,1840.0,Cuncolim,Salcete,"Proposal for the steel production of Reheating furnace followed by rerolling mill (120000 TPA), Induction Furnace (120000 TPA) in plot no. L-25, L-26, Cuncolim Industrial Estate, Cuncolim Salcete, Goa by M/s Orange Fox Steel Pvt. Ltd.","M/s Orange Fox Steel Pvt. Ltd. is proposing for the steel production of Reheating furnace followed by Rerolling mill (120000 TPA), Induction Furnace (120000 TPA) in the steel plant in plot no. L-25, L-26, Cuncolim Industrial Estate, Cuncolim Salcete, Goa.",GOA,South Goa,0.0,109800.0,"Plot no. L-25, L-26",South Goa,GOA,926704,https://parivesh.nic.in/dms/okm/downloadDocument?docTypemappingId=40829&refId=2712500&refType=caf&uuid=4b9ef764-373d-4586-9079-05ad1fc1bb7f&version=1.0,https://parivesh.nic.in/newupgrade/#/report/ec?proposalId=2715860
IA/GA/MIN/529454/2025,2025-03-14T07:05:44.332+00:00, FOMENTO RESOURCES PRIVATE LIMITED,B1,,152.5073,3680.0,SANTONA,Sanguem,Block IV – Kalay Mineral Block,"The Government of Goa, pursuant to the Mines and Minerals (Development and Regulation) Act, 1957 and its Rules thereunder and the Mineral (Auction) Rules, 2015, issued Notice Inviting Tender dated 30/09/2022 to commence the process for auction for grant of Mining Lease for Block IV – Kalay Mineral Block. The auction process was conducted on 21/12/2022 and Fomento Resources Private Limited was declared as “Preferred Bidder”. ;The Letter of Intent was issued on 13/01/2023, to be read with letter dated 13/03/2023, for the grant of Mining Lease. ;The area of the Mineral Block is 152.5073  Ha and is located in Santona village, Sanguem Taluka, South Goa District, Goa.;The proposed production capacity of Iron Ore is 0.75 MTPA. Mechanized open cast mining method will be adopted.;",GOA,South Goa,0.0,86355.0,"7/1,8/1,8/2,11/1,15/1,15/2,16/1,23/1,24/1,25/1,25/2,26/1,27/1,28/3,28/4,28/5,28/6,29/1,38/1,38/3,39/1,40/1,40/2,40/3,40/4,40/5,40/6,40/7,40/8,40/9,40/10,40/11,40/12,40/13,41/1,42/1,43/1,Nallah & Road",South Goa,GOA,626987,https://parivesh.nic.in/dms/okm/downloadDocument?docTypemappingId=40829&refId=4039413&refType=caf&uuid=e9fbd24b-2d0b-4980-b348-95731d9ec2bb&version=1.1,https://parivesh.nic.in/newupgrade/#/report/ec?proposalId=122412295
SIA/GA/INFRA2/406114/2022,2022-11-11T09:24:29.352+00:00,SHIVANAND BANDEKAR,B2,Building / Construction ,10.3,36850.0,BAMBOLI,0,"Expansion in the existing Built up Area from 52530.00 Sq. m to 76590.20 Sq. m (i.e., Construction of Tertiary Cancer Care Centre & Blood Bank within the existing site premises) by  M/s. Goa Medical College & Hospital ","Expansion in the existing Built up Area from 52530.00 Sq. m to 76590.20 Sq. m (i.e., Construction of Tertiary Cancer Care Centre & Blood Bank within the existing site premises) by ;M/s. Goa Medical College & Hospital ",GOA,North Goa,9950.0,9915.0,"Sy. No. 117 of Calapor Village & Sy. No. 46, 48 & 49 of Bambolim Village",North Goa,GOA,626733,https://parivesh.nic.in/dms/okm/downloadDocument?docTypemappingId=40829&refId=1486333&refType=caf&uuid=03a212fa-7511-424b-aeef-5c5770906053&version=1.2,https://parivesh.nic.in/newupgrade/#/report/ec?proposalId=1490902
SIA/GA/MIN/517609/2025,2025-01-07T10:07:38.826+00:00,GURUDAS MONE,B2,,5.0,15.0,Vaguriem,Satari,"Laterite Stone Quarry with a lease area of 5.00 Ha located on land bearing Survey No. 31/1 of Vaguriem Village, Sattari Taluka, North Goa by Gurudas Mone .","The proposal is for obtaining prior Environment Clearance for Laterite Stone Quarry located at Survey No. 31/1 of Vaguriem Village, Sattari Taluka, Goa, over an area of 5.00 Ha.",GOA,North Goa,0.0,4480.0,Survey No. 31/1 ,North Goa,GOA,626811,https://parivesh.nic.in/dms/okm/downloadDocument?docTypemappingId=40829&refId=116906856&refType=caf&uuid=d6a97e37-da13-4436-8797-dcfaa6b4c4b9&version=1.0,https://parivesh.nic.in/newupgrade/#/report/ec?proposalId=116910497
SIA/GA/IND1/414089/2023,2023-01-11T06:00:37.985+00:00,M/S GLOBAL ISPAAT PVT. LTD.,B1,Metallurgical Industries (ferrous and non ferrous),1.97,6000.0,Cuncolim,Salcete,"Proposed Expansion of MS Billet & TMT Bars manufacturing unit of M/s Global Ispaat Pvt. Ltd. at Plot no. L-16, L-17, M-18 & M-19, Survey Nos. 303/1, 303/3, 304/3, 327/4, 327/5, 295/1(p), 303/1 (p), 303/2 (p) & 303(p) of Cuncolim Industrial Estate, Cuncolim Village, Salcete Taluka, South-Goa District, State Goa","M/s Global Ispaat Pvt Ltd  proposes to expand the production capacity of MS billets and MS hot rolled products from 59,000 TPA to 4,50,000 TPA (increase in production by additional 3,91,000 TPA);The increase in production capacity will be achieved by installing new 25T X 3 nos. of induction furnaces (replacing 8T X 2nos. Induction Furnace (IF) to 25T X 3 nos.).;The unit is categorized under Category ‘B1’ of Schedule no. 3(a). The proposed unit is located in the notified industrial area. ",GOA,South Goa,0.0,91250.0,"Plot No. L-16, L-17, M-18, M-19, Survey No. 303/1, 303/3, 304/3, 327/4, 327/5, 295/1(p), 303/1(p), 303/2(p) & 303(p)",South Goa,GOA,926704,https://parivesh.nic.in/dms/okm/downloadDocument?docTypemappingId=40829&refId=2470752&refType=caf&uuid=0e1433b8-8722-4bfc-bf99-6494cc86e491&version=1.0,https://parivesh.nic.in/newupgrade/#/report/ec?proposalId=2472748
SIA/GA/MIN/492265/2024,2024-08-10T10:56:36.713+00:00,THE DIRECTOR OF MINES,B2,,3.1,0.0,Navelim,Bicholim,Mandovi River Sand Mining Zone-8,Sand mining in River Mandovi.,GOA,North Goa,0.0,0.0,,North Goa,GOA,626759,https://parivesh.nic.in/dms/okm/downloadDocument?docTypemappingId=40829&refId=92198972&refType=caf&uuid=e61f476f-b824-401c-9f58-e8da7ff1908a&version=1.1,https://parivesh.nic.in/newupgrade/#/report/ec?proposalId=92199284
SIA/GA/MIN/486962/2024,2024-07-10T07:29:01.228+00:00, SALGAOCAR SHIPPING COMPANY LIMITED,B1,,171.2472,12622.12,Sirigao,Bicholim,BLOCK-II - SIRIGAO-MAYEM MINERAL BLOCK,"BLOCK-II - SIRIGAO-MAYEM MINERAL BLOCK,  over an extent of 171.2472 Ha located in Sirigao & Mayem Villages of Bicholim Taluka of North Goa District, Goa. Production capacity is 1.0 MTPA of iron ore and Open cast mining with ‘A’ category mine",GOA,North Goa,0.0,35868.0,"1,2,3,4,5,6,7,46,47,48,84,90,91,92,93, 94, 95, 96, 97, 98 & Road",North Goa,GOA,626746,https://parivesh.nic.in/dms/okm/downloadDocument?docTypemappingId=40829&refId=5117576&refType=caf&uuid=1bad2dc6-3f7c-48bc-82d7-c0259043bf47&version=1.0,https://parivesh.nic.in/newupgrade/#/report/ec?proposalId=83051549
SIA/GA/INFRA2/500136/2024,2024-10-07T12:32:15.710+00:00,AMIT RANJAN MISRA,B2,Building / Construction ,10.83,52388.0,KITAL,Quepem,"Proposed Construction of Convention Centre, Exhibition Hall and Management Training Facility  at IPSHEM ONGC Campus, Village Betul, Tehsil Quepem, District – South Goa, Goa","Proposed Construction of Convention Centre, Exhibition Hall and Management Training Facility  at ;IPSHEM ONGC Campus, Village Betul, Tehsil Quepem, District – South Goa, Goa;Plot Area -10.83 Ha;Gross Built Up Area – 39,560 sq.m;FAR –33,719.41 sq.m;Non FAR -5840.6  sq.m;",GOA,South Goa,176640.0,147580.0,,South Goa,GOA,626951,https://parivesh.nic.in/dms/okm/downloadDocument?docTypemappingId=40829&refId=109053587&refType=caf&uuid=6403c9aa-a052-40be-95e4-ed7bc96e3fe1&version=1.0,https://parivesh.nic.in/newupgrade/#/report/ec?proposalId=109056414
SIA/GA/MIN/531011/2025,2025-03-24T06:04:43.488+00:00,AGRAVANSHI PRIVATE LIMITED ,B1,Mining of minerals,61.7325,2700.0,HONDA,Satari,Onda Mineral Block-X,"Onda Mineral Block-X. The Notice inviting tender to commence e-auction was issued on November 13, 2024, and AGRAVANSHI PRIVATE LIMTED was declared the ""preferred bidder."" The Letter of Intent was issued on December 10, 2024. The Mineral Block covers an area of 61.7325Ha and is located in Onda Village, Sattari Taluka, North Goa District, Goa. The proposed Iron Ore production capacity is 0.5 MTPA. The mine will be worked as mechanized Open cast Mine.",GOA,North Goa,0.0,18322.0,"Sy. No. 123, 124, 125, 126, 130, 132, 133, 134, 135, 136, 137, 138, 139, 140, 141, 143, Nallah & Road, ",North Goa,GOA,626842,https://parivesh.nic.in/dms/okm/downloadDocument?docTypemappingId=40829&refId=123166136&refType=caf&uuid=724a7736-3e7a-4b8e-a696-532390434767&version=1.0,https://parivesh.nic.in/newupgrade/#/report/ec?proposalId=123172191
SIA/GA/INFRA2/531160/2025,2025-03-24T18:16:11.723+00:00,nanu Estates Private Limited,B2,Building / Construction ,0.7411,7000.0,MADGAON,Salcete,M/S NANU ESTATES Pvt Ltd,"M/s Nanu Estates Pvt Ltd . proposes a commercial cum residential Apartment Project at Margao, Salcete–Goa .;;The project site is located atChalta No. 41 P.T Sheet No. 222, Aquem, Margao, Salcete– Goa.;;The Total land area is 7411.00 m2 and net effective plot area is 7013.00 m2 and the total proposed built-up area is 28,705.64 m2.;;",GOA,South Goa,73125.0,209635.0,,South Goa,GOA,803249,https://parivesh.nic.in/dms/okm/downloadDocument?docTypemappingId=40829&refId=122477549&refType=caf&uuid=ef251f94-7b7f-40c3-9f2e-119102a712a0&version=1.0,https://parivesh.nic.in/newupgrade/#/report/ec?proposalId=123284004
SIA/GA/INFRA2/506556/2024,2024-11-19T08:46:00.887+00:00, DLF EXCLUSIVE FLOORS PRIVATE LIMITED,B2,,14.3594,94200.0,Reis Magos (CT),Bardez,"Amendment in Environment Clearance for Construction of Group housing project ""The Bayview"" at survey no. 87/1-A-1,87/1-A-2 & 87/1-A-3 of Village Reis Magos, Taluka Bardez, North Goa, Goa.","M/s. Delanco Homes & Resorts Pvt. Ltd. obtained Environmental Clearance (EC) on 14 September 2017 for a residential project, including 84 villas and a clubhouse, covering a built-up area of 52,589.14 sqm on a plot of 106,345.66 sqm. The EC was transferred to DLF Exclusive Floors Pvt. Ltd. on 16 May 2023. ;The proponent now proposes revision in plans for 61 villas, increasing the built-up area to 98,704.79 sqm on a net  plot area of 130,484.66sqm. ",GOA,North Goa,36500.0,48545.0,"87/1-A-1,87/1-A-2 & 87/1-A-3",North Goa,GOA,626699,https://parivesh.nic.in/dms/okm/downloadDocument?docTypemappingId=40829&refId=111487626&refType=caf&uuid=2213afdd-abb2-453e-9314-71df19d45f68&version=1.0,https://parivesh.nic.in/newupgrade/#/report/ec?proposalId=111832729
SIA/GA/MIN/492268/2024,2024-08-10T11:01:40.831+00:00,THE DIRECTOR OF MINES,B2,,2.04,0.0,MAKAZAN,Salcete,Zuari River Sand Mining Zone-5,Sand mining in River Zuari,GOA,South Goa,0.0,0.0,,South Goa,GOA,626902,https://parivesh.nic.in/dms/okm/downloadDocument?docTypemappingId=40829&refId=91928512&refType=caf&uuid=d3fd54de-ebe0-46dc-9473-3941f6bfebc9&version=1.0,https://parivesh.nic.in/newupgrade/#/report/ec?proposalId=92199725
IA/GA/MIN/422323/2023,2023-03-16T05:45:26.300+00:00, VEDANTA LIMITED,A,Mining of minerals,478.5206,25000.0,Bordem,Bicholim,Block 1- Bicholim Mineral Block for Iron Ore,"Block 1-Bicholim Mineral Block over an extent of 478.5206 Ha located in Bicholim, Bordem, Lamgao, Mulgoa, Mayem & Sirigao Villages of Bicholim Taluka of North Goa District, Goa. Production capacity is 3.0 MTPA of Iron Ore and Open cast mining with ‘A’ category mine",GOA,North Goa,0.0,229220.0,"19,21,23,31,32,33,34,40,41,42,43, 44",North Goa,GOA,924814,https://parivesh.nic.in/dms/okm/downloadDocument?docTypemappingId=40829&refId=3995076&refType=caf&uuid=e73d4481-97c2-41dc-ac67-c2d1766c0314&version=1.2,https://parivesh.nic.in/newupgrade/#/report/ec?proposalId=3996409
SIA/GA/INFRA2/442508/2023,2023-08-31T06:03:07.448+00:00, RAJ HOUSING DEVELOPMENT PVT LTD,B2,Building / Construction ,1.9052,6050.377,MAPUCA,Bardez,"Proposed construction of a residential project ""Raj Enclave"" located in P.T. Sheet No.8 of Chalta No. 01 in Mapusa Municipal Council area of Bardez Taluka , North Goa, Goa","M/s. Raj Housing Development Pvt. Ltd. is  constructing a residential project  ""Raj Enclave"" located in P.T. Sheet No.8 of Chalta No. 01 in Mapusa Municipal Council area of Bardez Taluka on North Goa, Goa with a Total Plot Area of 19,052 sqm and Total Built-up Area of 30,252.35 sqm (Existing constructed built-up area= 16875.77 sqm and Proposed built-up area = 13,376.58 sqm )",GOA,North Goa,90.0,2190.0,P.T. Sheet No.8 of Chalta No. 01 ,North Goa,GOA,803242,https://parivesh.nic.in/dms/okm/downloadDocument?docTypemappingId=40829&refId=8869108&refType=caf&uuid=f3671dbd-3e35-413e-a566-be8f6ddc21c2&version=1.0,https://parivesh.nic.in/newupgrade/#/report/ec?proposalId=8870282
SIA/GA/INFRA2/523926/2025,2025-02-13T07:31:17.496+00:00,Adwalpalkar constructions and resorts private limited ,B2,Building / Construction ,1.1164,6700.0,Taleigao (OG) (Part),Tiswadi,"Proposed construction of a Residential cum Commercial Project by Adwalpalkar Constructions and Resorts Pvt. Ltd on plot bearing  Survey No. 204/4  in Taleigao village, Tiswadi Taluka, North Goa ","The proposed project involves the construction of a residential-cum-commercial development at Survey No. 204/4 in Taleigao Village, Tiswadi, Goa, covering a plot area of 11,164 m². The completed development currently comprises Blocks A and B, with a built-up area of 19,937.52 m². The project proponent now intends to add Blocks C, D, and E, along with three villas. This will increase the built-up area by 25,549.28 m², bringing the total built-up area to 45,486.8 m².",GOA,North Goa,25550.0,0.0,204/4,North Goa,GOA,645598,https://parivesh.nic.in/dms/okm/downloadDocument?docTypemappingId=40829&refId=119954442&refType=caf&uuid=33a3cc27-0ecb-47d8-b8dc-9ff1de582cce&version=1.0,https://parivesh.nic.in/newupgrade/#/report/ec?proposalId=119960121
SIA/GA/MIN/473269/2024,2024-05-17T05:45:27.201+00:00, R B S CANDIAPARCAR,,,3.42,1.355,DARBANDORA,Dharbandora,"Extension of Validity of Environment Clearance for Basalt Stone Quarry bearing lease no. 04/BASALT/93 admeasuring 3.42 Ha located at Survery.no.11/1(P) of Village Piliem, Taluka Dharbandora, South Goa, Goa","The proposal is for obtaining an Extension of Validity  for the Basalt Stone Quarry bearing Leas No. 04/Basalt/93 located at Survery.no.11/1(P) of Village Piliem, Taluka Dharbandora, South Goa, Goa",GOA,South Goa,0.0,1225.0,11/1(P),South Goa,GOA,626971,https://parivesh.nic.in/dms/okm/downloadDocument?docTypemappingId=40829&refId=68389264&refType=caf&uuid=5da69c81-1d3b-4613-b16b-25c88e59659f&version=1.0,https://parivesh.nic.in/newupgrade/#/report/ec?proposalId=68710608
SIA/GA/MIN/438243/2023,2023-07-27T06:22:16.187+00:00, GERVASIO FERNANDES & SONS,B2,Mining of minerals,4.0,10.0,Morambi-O-Grande (Merces) (OG),Tiswadi,"Proposed Basalt Quarry of Lease Area 4 Ha Located on Land Bearing Survey No. 213/1 of Village Morombi-o-Grande Of Tiswadi Taluka North Goa, Goa","The proposal is for obtaining prior Environment Clearance for Basalt Quarry located at Survey No. 213/1 of Village Morombi-o-Grande Of Tiswadi Taluka North Goa, Goa, over an area of 4 Ha.;",GOA,North Goa,0.0,1920.0,Survey No. 213/1,North Goa,GOA,626737,https://parivesh.nic.in/dms/okm/downloadDocument?docTypemappingId=40829&refId=7135348&refType=caf&uuid=65d0a69e-2c94-4221-875c-89492b6c9c51&version=1.0,https://parivesh.nic.in/newupgrade/#/report/ec?proposalId=7137408
IA/GA/MIN/464767/2024,2024-03-02T07:36:22.034+00:00, M/S VASSUDEVA TAMBA METAL QUARRY,,,1.2,19.9694,PANVELIM,Tiswadi,"Extension of validity of Environment Clearance for Basalt Stone Quarry bearing lease no.3/Basalt/05(Lease no. 3/Basalt/05 as per EC vide no.3-181-2010/STE-DIR/97 dated 21/03/2013 & its subsequent extensions, Consent To Operate vide no.12/2022-PCB/1441674/O00010711 dated 23/12/2022 & Lease no. 3/BASALT/Mur/Lat-Boulders/05 as per Lease Order no.34/316/2005-Mines/Part/2967 dated 15/01/2024) admeasuring 1.20 Ha located at Survey no.11/1, 11/2 & 11/6 at St. Pedro of Village Panelim,Taluka-Tiswadi,Goa","The proposal is for obtaining an extension of validity for the Basalt Stone Quarry bearing Lease No. 3/Basalt/05, (The Lease no. of the quarry is 3/Basalt 05/as per Environment clearance vide no.3-181-2010/STE-DIR/97  dated 21/03/2013) which was granted for a combined capacity at a production rate of 42,500 cubic meters per month for its two quarries sharing a common boundary belonging to M/S. Vassudeva Tamba Metal Quarry and recieved extension of validity  vide letter No. 3-181-2010/STE-DIR/222 dated 21/05/2020,vide letter No. 1-04-2021/GSEIAA/Misc/222 dated 06/12/2022. ;The Quarry admeasuring lease area of 1.20 hectares and is located at Survey No. 11/1, 11/2, and 11/6 in St. Pedro, Village Panaji, Taluka Tiswadi, North Goa, Goa. ",GOA,North Goa,0.0,6000.0,"11/1,11/2.11/6",North Goa,GOA,0,https://parivesh.nic.in/dms/okm/downloadDocument?docTypemappingId=40829&refId=51034719&refType=caf&uuid=64716ba0-1d10-4946-8b35-9c83d537f52f&version=1.1,https://parivesh.nic.in/newupgrade/#/report/ec?proposalId=51036099
SIA/GA/MIN/489411/2024,2024-07-23T12:13:57.299+00:00,Melba May Coutinho,,,0.6,15.0,UGEM,Sanguem,"Extension of validity of Environment Clearance for Basalt Stone Quarry bearing lease no. 10/Basalt/10-11 admeasuring 0.6 Ha located at survey no. 52/0(part), Village Uguem, Taluka Sanguem, South Goa District, Goa ","The proposal is for Extension of validity of Environment Clearance for Basalt Stone Quarry bearing lease no. 10/Basalt/10-11 admeasuring 0.6 Ha located at survey no. 52/0(part), Village Uguem, Taluka Sanguem, South Goa District, Goa ",GOA,South Goa,0.0,1680.0,52/0,South Goa,GOA,627003,https://parivesh.nic.in/dms/okm/downloadDocument?docTypemappingId=40829&refId=86853617&refType=caf&uuid=3508072b-985a-41b3-ab45-a2dfa38c3e94&version=1.0,https://parivesh.nic.in/newupgrade/#/report/ec?proposalId=86856856
SIA/GA/INFRA2/429361/2023,2023-05-16T05:32:13.548+00:00, EMGEE HOUSING PRIVATE LIMITED,B2,Building / Construction ,5.4998,938.36,Taleigao (OG) (Part),Tiswadi,"Residential Cum Commercial scheme in Survey nos. 225/1&4, 227 and 234/2 at Odxel, Taleigao, Ilhas, Goa","The construction of buildings is over a plot area of 54,998 Sq. mtrs. with a total built up area of 69,737.23 Sq.mtrs. A built-up area of 17,121.05 Sq.mtrs. is constructed and a built-up area of 52,616.18 is proposed. The project had a Environmental Clearance granted by EAC, MoEF&CC  on 11th December 2008",GOA,North Goa,14625.0,20075.0,"225/1 and 4, 227 and 234/2",North Goa,GOA,645598,https://parivesh.nic.in/dms/okm/downloadDocument?docTypemappingId=40829&refId=5348644&refType=caf&uuid=f9a0c7c6-976b-426e-b35f-c83a837ae770&version=1.0,https://parivesh.nic.in/newupgrade/#/report/ec?proposalId=5358428
IA/GA/IND1/452494/2023,2023-11-17T04:08:45.579+00:00, MALCO ENERGY LIMITED,A,,3.44,3000.0,Cuncolim,Salcete,"Proposed Amendment in existing Environmental Clearance for “Expansion of Cobalt, Copper, Nickel and Sodium Sulphate Unit at Plot No. L-15, L-19 & L- 20 Cuncolim Industrial Estate, Cuncolim, Goa”","After acquiring the asset Nicomet, MALCO Energy Ltd. (MEL) applied for transfer in Environmental Clearance for “Expansion of Cobalt, Copper, Nickel and Sodium Sulphate”.;Now, MEL is proposing amendment in existing Environmental Clearance for “Expansion of Cobalt, Copper, Nickel and Sodium Sulphate Unit at Plot No. L-15, L-19 & L- 20 Cuncolim Industrial Estate, Cuncolim, Goa.” ;As per EIA Notification dated 14th Sept., 2006 and subsequent amendments, the project falls under Category “A”, Project or Activity 3(a) Metallurgical Industries (ferrous & non–ferrous).;",GOA,South Goa,11680.0,143100.0,":	Plot Nos. L-15, L-19 & L-20",South Goa,GOA,926704,https://parivesh.nic.in/dms/okm/downloadDocument?docTypemappingId=40829&refId=8967536&refType=caf&uuid=d97ba221-9c5c-4e6f-a1bc-5f325bce6de0&version=1.0,https://parivesh.nic.in/newupgrade/#/report/ec?proposalId=24875244
SIA/GA/MIN/492157/2024,2024-08-10T04:32:40.966+00:00,THE DIRECTOR OF MINES,B2,,4.5,0.0,Borim (CT),Ponda,Zuari River Sand Mining Zone-2,Sand mining in River Zuari.,GOA,North Goa,0.0,0.0,,North Goa,GOA,626872,https://parivesh.nic.in/dms/okm/downloadDocument?docTypemappingId=40829&refId=91891653&refType=caf&uuid=d7f613e8-7b23-4afc-b788-518cf0170921&version=1.0,https://parivesh.nic.in/newupgrade/#/report/ec?proposalId=92167821
SIA/GA/MIN/404064/2022,2022-10-21T09:30:33.188+00:00, BHUMIPURUSHA MINERALS PRIVATE LIMITED,B1,Mining of minerals,40.92,60.0,Naquerim,Quepem,Naquerim Bauxite Mine,"Naquerim Bauxite Ore and Aluminous Laterite Mine;bearing Mining Lease No. 1/NSD/BAUXITE/85, dated;10.08.1987 over an extent of 40.92 Ha as per Mining Lease;Deed by M/S Bhumipurusha Minerals Pvt. Ltd.;",GOA,South Goa,0.0,10600.0,,South Goa,GOA,,https://parivesh.nic.in/dms/okm/downloadDocument?docTypemappingId=40829&refId=1241549&refType=caf&uuid=3129c380-b608-4e59-ba93-0e465d972c1e&version=1.0,https://parivesh.nic.in/newupgrade/#/report/ec?proposalId=1242504
SIA/GA/INFRA2/528620/2025,2025-03-10T07:04:39.251+00:00,SHIVANAND BANDEKAR,B2,Building / Construction ,23.025,17787.0,BAMBOLI,Tiswadi,"Proposed Expansion and Redevelopment of the Institute of Psychiatry & Human Behaviour, located on Survey No. 93/1 in Village Bambolim, Tiswadi Taluka, North Goa.","For the Environmental Clearance (EC) application of the proposed expansion and redevelopment of the Institute of Psychiatry & Human Behaviour, located on plot Survey No. 93/1 in Village Bambolim, Taluka Tiswadi, North Goa, we are seeking approval for a built-up area of 49,487.81 sqm. This  includes the built-up area of the existing structures, as well as the proposed 200-bedded hospital, administration block, and OPD block.",GOA,North Goa,29200.0,333975.0,93/1,North Goa,GOA,626733,https://parivesh.nic.in/dms/okm/downloadDocument?docTypemappingId=40829&refId=122064500&refType=caf&uuid=2c33e51d-a1fd-4605-b109-8b36c5c8c27f&version=1.0,https://parivesh.nic.in/newupgrade/#/report/ec?proposalId=122069937
SIA/GA/INFRA2/486902/2024,2024-07-09T17:12:42.787+00:00,OIL AND NATURAL GAS CORPORATION LIMITED,B2,Building / Construction ,10.83,52388.0,KITAL,Quepem,"Development of Convention Centre and Other Infrastructure Facilities at ONGC, Goa Campus","Proposed Construction of Convention Centre, Exhibition Hall and Management Training Facility ;at ;IPSHEM ONGC Campus, Village Betul, Tehsil Quempem, District – South Goa, Goa;Plot Area -10.83 Ha;Gross Built Up Area – 39,560 sq.m;FAR –33,719.41 sq.m;Non FAR -5840.6  sq.m;",GOA,South Goa,176640.0,22020.0,,South Goa,GOA,626951,https://parivesh.nic.in/dms/okm/downloadDocument?docTypemappingId=40829&refId=82762016&refType=caf&uuid=6b401c1a-df54-4ea4-ad8c-6c6514a30181&version=1.0,https://parivesh.nic.in/newupgrade/#/report/ec?proposalId=82762534
SIA/GA/MIN/474051/2024,2024-05-21T05:23:00.880+00:00, MARIA METAL,,,3.306,14.0,SANTONA,Sanguem,"Extension of Validity of Environment Clearance for Basalt Stone Quarry bearing lease no. 05/BASALT/03 admeasuring 3.306 Ha located at Survery.no.70/1 of Village Santona, Taluka Sanguem, South Goa, Goa","The proposal is for obtaining an Extension of Validity of Environment Clearance for the existing Basalt Stone Quarry bearing lease no. 05/Basalt/03 located at Survery.no.70/1 of Village Santona, Taluka Sanguem, South Goa, Goa",GOA,South Goa,0.0,1960.0,70/1,South Goa,GOA,626987,https://parivesh.nic.in/dms/okm/downloadDocument?docTypemappingId=40829&refId=69709567&refType=caf&uuid=c615bfec-e6c7-4394-8005-f6b6f0536ad4&version=1.0,https://parivesh.nic.in/newupgrade/#/report/ec?proposalId=69710153
SIA/GA/INFRA2/541979/2025,2025-06-18T13:15:27.040+00:00, MAHARASHTRA ACADEMY OF ENGINEERING AND EDUCATIONAL RESEARCH PUNE,B2,Building / Construction ,20.0,18000.0,DAT,Bardez,"Proposed  Maharashtra Academy of Engineering and Educational Research at    S.No.88, Sub-Division No. 1-B, Thivim Village of Bardez Taluka,  Goa by  M/S.  Maharashtra Academy of Engineering and Educational Research","Environment Clearance for  Proposed  Maharashtra Academy of Engineering and Educational Research at    S.No.88, Sub-Division No. 1-B, Thivim Village of Bardez Taluka,  Goa by  M/S.  Maharashtra Academy of Engineering and Educational Research",GOA,North Goa,127775.0,12515.0,,North Goa,GOA,626670,https://parivesh.nic.in/dms/okm/downloadDocument?docTypemappingId=40829&refId=130232397&refType=caf&uuid=794f5600-2dc2-4f98-b51d-36f6d60cb664&version=1.0,https://parivesh.nic.in/newupgrade/#/report/ec?proposalId=130237740
